{
  "$schema": "https://json-schema.org/draft/2020-12/schema",
  "$id": "https://threadlight.dev/schemas/governed-actions-apply-plan-1.0.0.json",
  "title": "threadlight-governed-actions apply plan",
  "description": "Emitted by threadlight-governed-actions alongside a manifest. Enumerates, per non-passing finding, what kind of remediation it needs and who/what applies it. self_applying is always false: threadlight-governed-actions never edits the target repository itself; every item is repo-edit (someone edits code), sibling-skill (a different skill applies it), manual (a human acts), or deferred-to-pipeline (a downstream CI/CD stage acts).",
  "type": "object",
  "additionalProperties": false,
  "required": [
    "schema",
    "assessor_version",
    "source_commit",
    "captured_at",
    "manifest_sha256",
    "self_applying",
    "items"
  ],
  "properties": {
    "schema": {
      "const": "threadlight-governed-actions-apply-plan/v1"
    },
    "assessor_version": {
      "type": "string"
    },
    "source_commit": {
      "$ref": "#/$defs/commit"
    },
    "captured_at": {
      "type": "string",
      "format": "date-time"
    },
    "manifest_sha256": {
      "$ref": "#/$defs/sha256"
    },
    "self_applying": {
      "const": false
    },
    "items": {
      "type": "array",
      "items": {
        "$ref": "#/$defs/item"
      }
    }
  },
  "$defs": {
    "sha256": {
      "type": "string",
      "pattern": "^sha256:[0-9a-f]{64}$"
    },
    "commit": {
      "type": "string",
      "pattern": "^[0-9a-f]{40}$",
      "description": "Full 40-character lowercase-hex git commit SHA."
    },
    "status": {
      "type": "string",
      "enum": ["pass", "must-fix", "should-fix", "not-verified", "not-applicable"]
    },
    "plane": {
      "type": "string",
      "enum": ["runtime", "change", "both"]
    },
    "item": {
      "type": "object",
      "additionalProperties": false,
      "required": [
        "finding_id",
        "status",
        "plane",
        "affected_actions",
        "affected_paths",
        "remediation_kind",
        "evidence_required",
        "owner",
        "depends_on"
      ],
      "properties": {
        "finding_id": {
          "type": "string"
        },
        "status": {
          "$ref": "#/$defs/status"
        },
        "plane": {
          "$ref": "#/$defs/plane"
        },
        "affected_actions": {
          "type": "array",
          "items": {
            "type": "string"
          }
        },
        "affected_paths": {
          "type": "array",
          "items": {
            "type": "string"
          }
        },
        "remediation_kind": {
          "type": "string",
          "enum": ["repo-edit", "sibling-skill", "manual", "deferred-to-pipeline"]
        },
        "evidence_required": {
          "type": "array",
          "items": {
            "type": "string"
          }
        },
        "owner": {
          "type": ["string", "null"]
        },
        "depends_on": {
          "type": "array",
          "items": {
            "type": "string"
          }
        }
      }
    }
  }
}
