{"assessor_version":"0.1.0","captured_at":"2026-09-01T12:00:00Z","items":[{"affected_actions":["payments.refund"],"affected_paths":["7024217f853a8a1a"],"depends_on":[],"evidence_required":["agent.yaml","app/agent.py"],"finding_id":"MED-001","owner":null,"plane":"runtime","remediation_kind":"repo-edit","status":"must-fix"},{"affected_actions":["payments.refund"],"affected_paths":["d0ad525d370bac91"],"depends_on":[],"evidence_required":["agent.yaml","app/agent.py"],"finding_id":"MED-001","owner":null,"plane":"runtime","remediation_kind":"repo-edit","status":"must-fix"},{"affected_actions":["payments.refund"],"affected_paths":["7024217f853a8a1a","d0ad525d370bac91"],"depends_on":[],"evidence_required":["agent.yaml","app/agent.py"],"finding_id":"MED-002","owner":null,"plane":"runtime","remediation_kind":"repo-edit","status":"must-fix"},{"affected_actions":[],"affected_paths":[],"depends_on":[],"evidence_required":[],"finding_id":"OPS-001","owner":null,"plane":"both","remediation_kind":"repo-edit","status":"should-fix"},{"affected_actions":[],"affected_paths":[],"depends_on":[],"evidence_required":[],"finding_id":"ACT-001","owner":null,"plane":"runtime","remediation_kind":"repo-edit","status":"not-verified"},{"affected_actions":[],"affected_paths":[],"depends_on":[],"evidence_required":[],"finding_id":"APR-001","owner":null,"plane":"runtime","remediation_kind":"manual","status":"not-verified"},{"affected_actions":[],"affected_paths":[],"depends_on":[],"evidence_required":[],"finding_id":"ENF-001","owner":null,"plane":"runtime","remediation_kind":"repo-edit","status":"not-verified"},{"affected_actions":[],"affected_paths":[".github/CODEOWNERS"],"depends_on":[],"evidence_required":[],"finding_id":"GHCP-002","owner":null,"plane":"change","remediation_kind":"manual","status":"not-verified"},{"affected_actions":[],"affected_paths":[],"depends_on":[],"evidence_required":[],"finding_id":"OUT-001","owner":null,"plane":"runtime","remediation_kind":"repo-edit","status":"not-verified"}],"manifest_sha256":"sha256:c1ce399fb98aa9fdb96204815fe5869426a0d71e156d9aa48a7b5807b91066d1","schema":"threadlight-governed-actions-apply-plan/v1","self_applying":false,"source_commit":"0123456789abcdef0123456789abcdef01234567"}
